{
  "id": "fire_apartment_smoke",
  "title": "Пожар в многоквартирном доме: дым в квартире",
  "group_name": "пожар в жилом доме",
  "incident_type_code": "1050102",
  "close_incident_type_codes": ["1050101", "1050002"],
  "expected_tags": ["victims", "gasification"],
  "optional_tags": ["no_access"],
  "expected_services": ["101", "102", "103", "104", "MOSLIFT"],
  "questionnaire_id": "fire_apartment",
  "caller": {
    "name": "Соснина Ольга",
    "phone": "+79161234567",
    "status": "очевидец"
  },
  "persona": {
    "kind": "young_woman",
    "age": 22,
    "label": "Девушка, 22 года"
  },
  "start_panic": 3,
  "background": "stairwell_alarm",
  "address": {
    "city": "Москва",
    "okrug": "САО",
    "district": "Западное Дегунино",
    "street": "Дубнинская улица",
    "house": "12",
    "building": "",
    "apartment": "47",
    "entrance": "2",
    "floor": "5",
    "descriptive": "Напротив дома продуктовый магазин, через дорогу школа"
  },
  "named_address_fields": ["district", "entrance", "floor", "descriptive"],
  "opening": "Алло! Алло, это пожарные?! У соседки из-под двери дым валит, она не открывает! Я не знаю, что делать!",
  "landmark_synonyms": ["продуктовый магазин", "напротив магазина", "через дорогу школа", "напротив школы"],
  "description_reference": "Задымление в квартире 47 на пятом этаже дома 12 по Дубнинской улице: из-под двери идёт густой дым, открытого огня заявитель не видит; в квартире пожилая соседка, не выходит на стук, квартира заперта изнутри, подъезд открыт.",
  "description_facts": [
    {
      "title": "дым из-под двери",
      "synonyms": [
        "дым",
        "задымление",
        "задымлено",
        "дымит",
        "дымится",
        "запах гари"
      ]
    },
    {
      "title": "открытого огня нет",
      "synonyms": [
        "огня не",
        "огня нет",
        "огонь не",
        "без огня",
        "без открытого огня",
        "огня не видит",
        "огня не видно",
        "огня не вижу",
        "огня не видела",
        "не видно огня",
        "пламени не",
        "пламени нет",
        "пламя не",
        "без пламени",
        "горения нет",
        "только дым"
      ]
    },
    {
      "title": "в квартире пожилая соседка",
      "synonyms": [
        "пожилая",
        "пожилой",
        "бабушка",
        "старушка",
        "пенсионерка",
        "соседка",
        "Нина Петровна",
        "человек в квартире",
        "люди в квартире",
        "внутри человек",
        "живёт одна"
      ]
    },
    {
      "title": "не отвечает на стук",
      "synonyms": [
        "не отвечает",
        "не открывает",
        "не выходит",
        "не реагирует",
        "не отзывается",
        "не откликается",
        "нет ответа",
        "молчит",
        "не слышно"
      ]
    },
    {
      "title": "квартира заперта",
      "synonyms": [
        "заперта",
        "заперто",
        "закрыта",
        "закрыто",
        "на замке",
        "не попасть",
        "нет доступа",
        "вскрыть дверь",
        "вскрытие двери"
      ]
    },
    {
      "title": "пятый этаж",
      "synonyms": ["пятый этаж", "5 этаж", "этаж пятый"]
    }
  ],
  "answers": {
    "address": {
      "calm": "Дубнинская улица, дом двенадцать, квартира сорок семь, это соседка. Район Западное Дегунино.",
      "panic": "Это... Дубининская, кажется, дом двенадцать, а квартиру точно не помню, соседняя дверь!"
    },
    "landmark": {
      "calm": "Напротив дома продуктовый магазин, а через дорогу — школа.",
      "panic": "Магазин какой-то напротив... Я не знаю! Приезжайте!"
    },
    "callback": {
      "calm": "Да, это мой мобильный.",
      "panic": "Да, да, мой! Быстрее!"
    },
    "name": {
      "calm": "Соснина Ольга.",
      "panic": "Ольга! Какая разница, как меня зовут?!"
    },
    "what_happened": {
      "calm": "Из-под двери соседней квартиры идёт густой дым, открытого огня я не вижу.",
      "panic": "Дым везде, вообще ничего не видно, там что-то горит, не знаю что!"
    },
    "since": {
      "calm": "Минут пять назад почувствовала запах гари, а потом пошёл дым.",
      "panic": "Не знаю! Недавно! Я не засекала!"
    },
    "victims": {
      "calm": "Там живёт бабушка, Нина Петровна, она одна. На стук не отвечает.",
      "panic": "Там бабушка! Она не открывает! Совсем не отвечает!"
    },
    "self_safety": {
      "calm": "Я у своей двери, у меня дыма пока немного.",
      "panic": "Не знаю! Мне страшно тут стоять!"
    },
    "floor": {
      "calm": "Второй подъезд, мы на пятом этаже.",
      "panic": "Пятый... кажется, пятый этаж, я не уверена!"
    },
    "access": {
      "calm": "Дверь в подъезд открыта, домофон не нужен, а квартира заперта изнутри.",
      "panic": "Подъезд открыт, а дверь в квартиру заперта, я не могу попасть внутрь!"
    },
    "gas": {
      "calm": "У соседей обычная газовая плита, баллонов нет.",
      "panic": "Не знаю про газ, там вроде обычная плита, я не знаю точно!"
    }
  },
  "address_confirmation": {
    "ok": "Да, всё верно. Дубнинская, двенадцать, квартира сорок семь.",
    "wrong_street": "Нет-нет, не так! Дубнинская улица! Дубнинская!",
    "wrong_details": "Нет... Дом двенадцать, квартира сорок семь. Запишите правильно.",
    "empty": "Я же говорю: Дубнинская улица, дом двенадцать!",
    "panic": "Да... наверное... я не знаю, быстрее!"
  },
  "reactions": {
    "hysteria": [
      "Я не знаю! Там дым! Сделайте что-нибудь!",
      "Какая разница?! Приезжайте быстрее, там человек!",
      "Я не понимаю, что вы спрашиваете! Тут дым!"
    ],
    "calming": "Я... хорошо... я пытаюсь. Там дым, понимаете?",
    "calmed": "Да... хорошо. Я слушаю.",
    "order": "Как я могу успокоиться?! Там человек за дверью!",
    "repeat": "Я же уже сказала!",
    "not_understood": "Что? Я не понимаю! Повторите!",
    "irrelevant": "При чём тут это? Помогите быстрее!",
    "hold": "Да, я здесь.",
    "pause": ["Алло?! Вы меня слышите?!", "Алло! Алло! Не бросайте трубку!"]
  },
  "advice": [
    {
      "key": "leave",
      "text": "Не открывайте дверь к соседке. Выйдите на улицу и встречайте пожарных у подъезда.",
      "reply": "Хорошо. Я выйду на улицу и встречу пожарных."
    },
    {
      "key": "smoke",
      "text": "Прикройте нос и рот мокрой тканью и спускайтесь по лестнице на улицу. Лифтом не пользуйтесь.",
      "reply": "Хорошо... закрываю лицо... спускаюсь по лестнице."
    }
  ],
  "escalation": {
    "after_question": "victims",
    "after_s": 50,
    "latest_s": 100,
    "text": "Ой... дым уже на лестнице! Мне тяжело дышать!",
    "fact": {
      "title": "дым дошёл до лестницы",
      "synonyms": [
        "на лестнице",
        "лестничной",
        "на площадке",
        "лестница",
        "пролёт",
        "коридор",
        "дым распространяется",
        "тяжело дышать",
        "трудно дышать",
        "задыхается"
      ]
    },
    "advice": "smoke"
  },
  "distractors": [
    {
      "key": "postcode",
      "step": 1,
      "text": "Какой у дома почтовый индекс?",
      "reply": "Индекс?! Я не знаю индекс! Приезжайте скорее!"
    },
    {
      "key": "home_phone",
      "step": 2,
      "text": "У вас есть домашний телефон?",
      "reply": "Зачем вам домашний?! Нет у меня!"
    },
    {
      "key": "called_fire",
      "step": 3,
      "text": "Вы уже звонили в пожарную охрану?",
      "reply": "Я вам и звоню! Вы же пожарные?!"
    },
    {
      "key": "pets",
      "step": 4,
      "text": "У соседки есть домашние животные?",
      "reply": "Кошка у неё... Это сейчас важно?!"
    },
    {
      "key": "door_color",
      "step": 5,
      "text": "Какого цвета дверь у соседки?",
      "reply": "Коричневая... Какая разница, какого цвета?!"
    }
  ],
  "reference_order": [
    "«Успокоить» — просьба с причиной: «Мне нужен адрес, чтобы отправить помощь». Повторять подряд, пока заявительница не заговорит спокойно и не назовёт адрес.",
    "Внести адрес в карточку и повторить его вслух: «Проверю адрес…». Повтор ловит ошибку на слух: Дубнинская, а не Дубининская.",
    "Уточнить ориентир: магазин напротив, школа через дорогу.",
    "Подтвердить номер для обратной связи и спросить имя.",
    "«Открытый огонь или задымление?» — огня нет, значит тип «задымление: квартира».",
    "«Остались люди?» — за дверью бабушка, отметить «Пострадавшие». Узнать, в безопасности ли сама заявительница.",
    "Подъезд, этаж, доступ и газ — в карточку; службы подставятся по отметкам.",
    "Дым дошёл до лестницы — совет: прикрыть нос мокрой тканью, спускаться по лестнице, не в лифте.",
    "Описание своими словами и «сохранить» — в пределах трёх минут."
  ],
  "notes": "Персонаж — девушка, стартует в истерике: вопросы не слышны, пока не применён приём «Успокоить» с причиной; повторять его подряд. Ловушка Q&A 16.09: правильное название — Дубнинская улица; в панической реплике заявительница называет «Дубининскую». Оператор должен внести в карточку верный адрес, а не то, что послышалось; повтор адреса вслух ловит ошибку. В доме газовые плиты — «Проведена ли газификация: Да», служба 104 (Мосгаз), как в прототипе этапа 3."
}
