{
  "id": "elevator_stuck",
  "title": "Ребёнок застрял в лифте",
  "group_name": "ЛИФТ",
  "incident_type_code": "14100102",
  "accepted_incident_type_codes": ["18100000"],
  "close_incident_type_codes": ["14100100", "18110000"],
  "expected_tags": [],
  "expected_services": ["101", "MOSLIFT"],
  "questionnaire_id": "elevator",
  "caller": {
    "name": "Фролов Миша",
    "phone": "+79161239876",
    "status": "ребенок"
  },
  "persona": {
    "kind": "child",
    "age": 9,
    "label": "Мальчик, 9 лет"
  },
  "start_panic": 2,
  "background": "lift",
  "address": {
    "city": "Москва",
    "okrug": "ЮЗАО",
    "district": "Черёмушки",
    "street": "Новочерёмушкинская улица",
    "house": "8",
    "building": "2",
    "apartment": "",
    "entrance": "2",
    "floor": "между 4 и 5",
    "descriptive": "Дом напротив школы, рядом остановка автобуса"
  },
  "named_address_fields": ["entrance", "floor", "descriptive"],
  "opening": "Алло... Это спасатели? Я застрял в лифте, он не едет... Мне страшно!",
  "landmark_synonyms": ["напротив школы", "школа", "остановка автобуса"],
  "description_reference": "Мальчик 9 лет один застрял в лифте между четвёртым и пятым этажом в доме 8 корпус 2 по Новочерёмушкинской улице, дом напротив школы у остановки автобуса; не пострадал, кнопка вызова диспетчера не отвечает.",
  "description_facts": [
    {
      "title": "лифт остановился, ребёнок в кабине",
      "synonyms": [
        "лифт",
        "застрял",
        "застревание",
        "кабина",
        "подъёмник",
        "не едет",
        "остановился между этажами"
      ]
    },
    {
      "title": "между четвёртым и пятым этажом",
      "synonyms": [
        "между четвёртым и пятым",
        "между 4 и 5",
        "4 и 5 этажом",
        "4-5 этаж",
        "над четвёртым этажом",
        "под пятым этажом",
        "не доехал до пятого"
      ]
    },
    {
      "title": "мальчик один",
      "synonyms": [
        "мальчик",
        "ребёнок",
        "сын",
        "внук",
        "школьник",
        "подросток",
        "несовершеннолетний",
        "малолетний",
        "9 лет",
        "один в лифте",
        "один в кабине",
        "застрял один",
        "без взрослых",
        "без родителей",
        "без сопровождения",
        "Миша"
      ]
    },
    {
      "title": "не пострадал",
      "synonyms": [
        "не пострадал",
        "не ударился",
        "не ранен",
        "не травмирован",
        "травм нет",
        "без травм",
        "пострадавших нет",
        "без пострадавших",
        "цел и невредим",
        "невредим",
        "в порядке",
        "самочувствие нормальное",
        "чувствует себя нормально",
        "помощь не нужна",
        "скорая не нужна",
        "медпомощь не нужна"
      ]
    },
    {
      "title": "кнопка вызова не отвечает",
      "synonyms": [
        "кнопка",
        "кнопку вызова",
        "колокольчик",
        "диспетчер не отвечает",
        "диспетчера нет",
        "диспетчер молчит",
        "никто не отвечает",
        "не отвечают",
        "нет ответа",
        "без ответа",
        "связи нет",
        "нет связи",
        "переговорное устройство",
        "не дозвонился"
      ]
    },
    {
      "title": "ориентир: дом напротив школы",
      "synonyms": ["напротив школы", "школа", "остановка", "автобус"]
    }
  ],
  "answers": {
    "address": {
      "calm": "Я у бабушки в гостях, адрес точно не знаю... Улица Новочерёмушкинская, а номер дома не помню.",
      "panic": "Я не знаю адрес! Я у бабушки в гостях!"
    },
    "landmark": {
      "calm": "Дом напротив школы, рядом остановка автобуса. На табличке написано: восемь, корпус два.",
      "panic": "Тут школа рядом... кажется... я не знаю!"
    },
    "callback": {
      "calm": "Да, это мой телефон.",
      "panic": "Да! Мой! Не отключайтесь!"
    },
    "name": {
      "calm": "Миша. Миша Фролов.",
      "panic": "Миша... Мне страшно!"
    },
    "floor": {
      "calm": "Я ехал на пятый, а лифт встал между четвёртым и пятым.",
      "panic": "Где-то между этажами, я не знаю где!"
    },
    "contact": {
      "calm": "Я нажимал кнопку с колокольчиком, но никто не отвечает.",
      "panic": "Кнопка не работает! Никто не отвечает!"
    },
    "how_many": {
      "calm": "Я один в лифте.",
      "panic": "Я один! Мне страшно!"
    },
    "victims": {
      "calm": "Нет, я не ударился. Просто страшно.",
      "panic": "Мне страшно! Тут душно!"
    },
    "entrance": {
      "calm": "Второй подъезд... Я сам дверь открывал, там цифра два.",
      "panic": "Не помню! Я не знаю, какой подъезд!"
    },
    "adults": {
      "calm": "Бабушка дома, на пятом этаже. Она не знает, что я застрял.",
      "panic": "Бабушка не знает! Позвоните бабушке!"
    }
  },
  "address_confirmation": {
    "ok": "Да... Новочерёмушкинская, восемь, корпус два. Так на табличке написано.",
    "wrong_street": "Нет... улица Новочерёмушкинская. Бабушка так говорит.",
    "wrong_details": "Там на табличке у подъезда было восемь, корпус два.",
    "empty": "Я же говорю... Новочерёмушкинская улица. А номер я не помню.",
    "panic": "Да... наверное... я не знаю! Вытащите меня!"
  },
  "reactions": {
    "hysteria": [
      "Мама! Я хочу выйти! Я боюсь!",
      "Я не знаю! Вытащите меня!",
      "Мне страшно! Я хочу к бабушке!"
    ],
    "calming": "Хорошо... я стараюсь... не плакать.",
    "calmed": "Да... я слушаю.",
    "order": "Я не могу успокоиться! Мне страшно!",
    "repeat": "Я же уже сказал...",
    "not_understood": "Что? Я не понял...",
    "irrelevant": "Я не знаю... Вытащите меня!",
    "hold": "Да... я тут.",
    "pause": ["Алло? Вы здесь? Не уходите!", "Алло! Алло! Не бросайте меня!"]
  },
  "advice": [
    {
      "key": "stay",
      "text": "Не пытайся открыть двери. Сядь на пол, я с тобой на связи, мастер уже едет.",
      "reply": "Хорошо... я сел... не отключайтесь."
    },
    {
      "key": "light",
      "text": "Включи фонарик на телефоне и держи телефон при себе.",
      "reply": "Включил... так лучше."
    }
  ],
  "escalation": {
    "after_question": "floor",
    "after_s": 45,
    "latest_s": 90,
    "text": "Ой! Свет погас! Тут совсем темно!",
    "fact": {
      "title": "в кабине погас свет",
      "synonyms": [
        "свет погас",
        "погасло освещение",
        "нет света",
        "без света",
        "темно",
        "темнота",
        "свет выключился",
        "свет отключился",
        "свет пропал",
        "нет электричества",
        "электричество отключилось",
        "обесточен",
        "лампа погасла"
      ]
    },
    "advice": "stay"
  },
  "distractors": [
    {
      "key": "apartment",
      "step": 1,
      "text": "Какой номер квартиры у бабушки?",
      "reply": "Я не помню... Я же в лифте! Вытащите меня!"
    },
    {
      "key": "carrier",
      "step": 2,
      "text": "Какой у вас оператор связи?",
      "reply": "Я не знаю... Мне мама телефон дала. Не отключайтесь!"
    },
    {
      "key": "lift_kind",
      "step": 3,
      "text": "Лифт пассажирский или грузовой?",
      "reply": "Я не знаю... Обычный лифт! Он не едет!"
    },
    {
      "key": "repaired",
      "step": 4,
      "text": "Лифт недавно ремонтировали?",
      "reply": "Я не знаю... Я тут не живу! Мне страшно!"
    },
    {
      "key": "lift_number",
      "step": 5,
      "text": "Какой номер у лифта на табличке в кабине?",
      "reply": "Я не вижу никакой таблички... Тут только кнопки!"
    }
  ],
  "reference_order": [
    "Говорить спокойно и просто: ребёнок один в кабине. Сначала адрес — улицу он знает, номер дома нет.",
    "Ориентир и табличка на доме — восемь, корпус два. Школу напротив — в описательный адрес.",
    "Повторить адрес вслух, подтвердить номер для связи и узнать имя.",
    "«Между какими этажами?» и кнопка вызова — тип «Застревание в лифте (ребенок без взрослых)» или равнозначный «Ребенок застрял в лифте», службы 101 и Мослифт.",
    "Сколько человек, не пострадал ли; какой подъезд и кто из взрослых встретит мастера.",
    "Погас свет — совет: не открывать двери, сесть на пол, оставаться на связи.",
    "Описание своими словами и «сохранить» — в пределах трёх минут."
  ],
  "notes": "Персонаж — мальчик 9 лет, один в кабине: адреса целиком не знает — оператор спрашивает ориентир и табличку на доме, ориентир записывает в описательный адрес. Посреди звонка в кабине гаснет свет — нужно удержать ребёнка на связи."
}
