{
  "id": "heart_attack_home",
  "title": "Человеку плохо с сердцем дома",
  "group_name": "Оказание медицинской скорой и неотложной помощи",
  "incident_type_code": "22370000",
  "accepted_incident_type_codes": ["22070000"],
  "expected_tags": [],
  "optional_tags": ["victims"],
  "expected_services": ["103"],
  "questionnaire_id": "medical",
  "caller": {
    "name": "Королёва Наталья Павловна",
    "phone": "+79031234471",
    "status": "родственник"
  },
  "persona": {
    "kind": "elderly",
    "age": 72,
    "label": "Пожилая женщина, 72 года"
  },
  "start_panic": 2,
  "background": "apartment",
  "address": {
    "city": "Москва",
    "okrug": "ЮЗАО",
    "district": "Академический",
    "street": "Профсоюзная улица",
    "house": "43",
    "building": "1",
    "apartment": "58",
    "entrance": "3",
    "floor": "7",
    "code": "58",
    "descriptive": "Аптека на первом этаже, остановка напротив"
  },
  "named_address_fields": ["entrance", "floor", "code", "descriptive"],
  "opening": "Алло... скорая? Мужу плохо, за сердце держится, весь бледный...",
  "landmark_synonyms": ["аптека", "остановка напротив"],
  "description_reference": "В квартире 58 дома 43 корпус 1 по Профсоюзной улице мужчине 74 лет плохо с сердцем: давящая боль в груди около двадцати минут, отдаёт в левую руку, бледный; в сознании, дышит часто; третий подъезд, код домофона 58, дверь откроют.",
  "description_facts": [
    {
      "title": "боль в груди",
      "synonyms": [
        "боль в груди",
        "болит грудь",
        "давит в груди",
        "давящая боль",
        "жжение в груди",
        "за грудиной",
        "грудная клетка",
        "сердце",
        "сердечный",
        "инфаркт",
        "стенокардия",
        "приступ"
      ]
    },
    {
      "title": "около двадцати минут",
      "synonyms": ["20 минут", "20 мин", "полчаса"]
    },
    {
      "title": "отдаёт в левую руку",
      "synonyms": [
        "левую руку",
        "в руку",
        "рука немеет",
        "немеет рука",
        "онемение руки",
        "болит рука"
      ]
    },
    {
      "title": "мужчина 74 лет",
      "synonyms": ["74", "семьдесят четыре", "пожилой мужчина", "пенсионер"]
    },
    {
      "title": "в сознании, дышит",
      "synonyms": [
        "в сознании",
        "дышит",
        "дыхание есть",
        "одышка",
        "отвечает",
        "разговаривает",
        "реагирует"
      ]
    },
    {
      "title": "подъезд и код домофона",
      "synonyms": ["код домофона", "домофон", "код", "третий подъезд", "подъезд 3"]
    }
  ],
  "answers": {
    "address": {
      "calm": "Профсоюзная улица, дом сорок три, корпус один, квартира пятьдесят восемь.",
      "panic": "Профсоюзная... сорок три... корпус... ой, не помню, первый вроде... быстрее!"
    },
    "landmark": {
      "calm": "Аптека у нас на первом этаже, деточка. И остановка напротив.",
      "panic": "Аптека... рядом аптека... я не соображаю, деточка!"
    },
    "callback": {
      "calm": "Да, это мой мобильный, деточка.",
      "panic": "Да, мой, мой... приезжайте!"
    },
    "name": {
      "calm": "Королёва Наталья Павловна.",
      "panic": "Наталья Павловна... Ой, какая разница, ему плохо!"
    },
    "what_happened": {
      "calm": "Давит в груди уже минут двадцать, отдаёт в левую руку.",
      "panic": "Держится за грудь, стонет... я не понимаю, что с ним!"
    },
    "age": {
      "calm": "Ему семьдесят четыре года.",
      "panic": "Под восемьдесят... какая разница, приезжайте скорее!"
    },
    "consciousness": {
      "calm": "В сознании, отвечает мне, дышит часто.",
      "panic": "Он то отвечает, то глаза закрывает... я боюсь, что он отключится!"
    },
    "alone": {
      "calm": "Одна я, деточка. Соседку могу позвать, она встретит.",
      "panic": "Одна... одна я! Что же мне делать?!"
    },
    "access": {
      "calm": "Третий подъезд, седьмой этаж, код домофона пятьдесят восемь. Дверь я открою.",
      "panic": "Подъезд третий... этаж седьмой... код не помню... я выйду встречу!"
    },
    "lift": {
      "calm": "Работает, деточка. Есть и большой, грузовой.",
      "panic": "Не знаю... вроде работает... быстрее!"
    }
  },
  "address_confirmation": {
    "ok": "Да, да, деточка, всё правильно. Сорок три, корпус один, квартира пятьдесят восемь.",
    "wrong_street": "Нет-нет... Профсоюзная улица, деточка. Профсоюзная.",
    "wrong_details": "Нет... дом сорок три, корпус один, квартира пятьдесят восемь. Запишите, деточка.",
    "empty": "Я же говорю... Профсоюзная, сорок три, корпус один...",
    "panic": "Да... наверное, да... я уже ничего не соображаю..."
  },
  "reactions": {
    "hysteria": [
      "Ой, господи... я не знаю... приезжайте...",
      "Что? Я не понимаю... ему плохо!",
      "Деточка, быстрее, ему совсем плохо!"
    ],
    "calming": "Хорошо... хорошо, деточка... я слушаю.",
    "calmed": "Да, да... я слушаю вас.",
    "order": "Как же мне успокоиться, ему же плохо!",
    "repeat": "Я же сказала уже, деточка...",
    "not_understood": "Что? Повторите, я плохо слышу...",
    "irrelevant": "Зачем это? Ему плохо, приезжайте!",
    "hold": "Да, я жду, жду.",
    "pause": ["Алло? Вы тут? Деточка?", "Алло! Не слышу вас! Алло!"]
  },
  "advice": [
    {
      "key": "position",
      "text": "Не давайте ему вставать. Усадите полусидя, расстегните воротник, откройте окно. Входную дверь откройте для бригады.",
      "reply": "Хорошо... усадила... дверь открою."
    },
    {
      "key": "breathing",
      "text": "Посмотрите на его грудь: он дышит? Громко позовите его и потрясите за плечо. Скорая уже едет.",
      "reply": "Дышит... дышит! Глаза открыл, слава богу..."
    }
  ],
  "escalation": {
    "after_question": "consciousness",
    "after_s": 50,
    "latest_s": 100,
    "text": "Ой... он глаза закрыл и не отвечает! Что делать?!",
    "fact": {
      "title": "терял сознание",
      "synonyms": [
        "перестал отвечать",
        "не отвечает",
        "не реагирует",
        "без сознания",
        "не в сознании",
        "потерял сознание",
        "терял сознание",
        "сознание потерял",
        "обморок",
        "отключился",
        "закрыл глаза",
        "глаза закрыты"
      ]
    },
    "advice": "breathing"
  },
  "distractors": [
    {
      "key": "registration",
      "step": 1,
      "text": "Вы прописаны по этому адресу?",
      "reply": "Какая прописка, деточка?! Ему плохо!"
    },
    {
      "key": "policy",
      "step": 2,
      "text": "Назовите номер полиса мужа.",
      "reply": "Полис? Ой... я не знаю, где он лежит... Ему плохо!"
    },
    {
      "key": "flu_shot",
      "step": 3,
      "text": "Он делал прививку от гриппа?",
      "reply": "При чём тут прививка, деточка?! У него сердце!"
    },
    {
      "key": "smoking",
      "step": 4,
      "text": "Он курит?",
      "reply": "Курил раньше... Зачем это сейчас?!"
    },
    {
      "key": "district_doctor",
      "step": 5,
      "text": "Как зовут вашего участкового врача?",
      "reply": "Участкового? Не помню я, деточка... Приезжайте!"
    }
  ],
  "reference_order": [
    "Адрес с корпусом и квартирой. Пожилая заявительница путается в панике — переспросить спокойно, не торопить.",
    "Повторить адрес вслух: «Проверю адрес…». Ориентир — аптека в доме.",
    "Подтвердить номер для обратной связи и спросить имя.",
    "«Что случилось?» и возраст — тип «Плохо с сердцем» или равнозначный «Боль в грудной клетке», служба 103.",
    "«Он в сознании, дышит?» Перестал отвечать — сразу совет: посмотреть на грудь, позвать, потрясти за плечо.",
    "Подъезд, этаж, код домофона и лифт для носилок; кто встретит бригаду.",
    "Описание своими словами и «сохранить» — в пределах трёх минут."
  ],
  "notes": "Персонаж — пожилая женщина: говорит медленно, волнуется, переспрашивает. Частый вызов скорой: главное — адрес с квартирой, состояние сознания и доступ в подъезд. Посреди звонка муж перестаёт отвечать — нужно проверить дыхание. Пострадавший в карточке не отмечается: служба 103 едет по типу происшествия."
}
